{
  "project_id": "DEMO-ONLY",
  "scope": "EXAMPLE",
  "stages": [
    {
      "stage_id": "DISCOVER",
      "status": "PASS",
      "owner": "example-owner",
      "reason": "",
      "revisit_trigger": "",
      "evidence_refs": [
        "evidence://sample/discovery"
      ]
    },
    {
      "stage_id": "ASSESS",
      "status": "REQUIRED",
      "owner": "example-owner",
      "reason": "",
      "revisit_trigger": "",
      "evidence_refs": []
    },
    {
      "stage_id": "INITIATE",
      "status": "REQUIRED",
      "owner": "example-owner",
      "reason": "",
      "revisit_trigger": "",
      "evidence_refs": []
    },
    {
      "stage_id": "SPECIFY",
      "status": "REQUIRED",
      "owner": "example-owner",
      "reason": "",
      "revisit_trigger": "",
      "evidence_refs": []
    },
    {
      "stage_id": "DESIGN",
      "status": "REQUIRED",
      "owner": "example-owner",
      "reason": "",
      "revisit_trigger": "",
      "evidence_refs": []
    },
    {
      "stage_id": "IMPLEMENT",
      "status": "REQUIRED",
      "owner": "example-owner",
      "reason": "",
      "revisit_trigger": "",
      "evidence_refs": []
    },
    {
      "stage_id": "VERIFY",
      "status": "REQUIRED",
      "owner": "example-owner",
      "reason": "",
      "revisit_trigger": "",
      "evidence_refs": []
    },
    {
      "stage_id": "RELEASE",
      "status": "REQUIRED",
      "owner": "example-owner",
      "reason": "",
      "revisit_trigger": "",
      "evidence_refs": []
    },
    {
      "stage_id": "OPERATE_SUPPORT",
      "status": "REQUIRED",
      "owner": "example-owner",
      "reason": "",
      "revisit_trigger": "",
      "evidence_refs": []
    },
    {
      "stage_id": "IMPROVE",
      "status": "REQUIRED",
      "owner": "example-owner",
      "reason": "",
      "revisit_trigger": "",
      "evidence_refs": []
    },
    {
      "stage_id": "EVOLVE",
      "status": "REQUIRED",
      "owner": "example-owner",
      "reason": "",
      "revisit_trigger": "",
      "evidence_refs": []
    },
    {
      "stage_id": "RETIRE",
      "status": "N_A",
      "owner": "example-owner",
      "reason": "Illustrative example: replace with project-specific evidence and rationale.",
      "revisit_trigger": "Illustrative example: replace with project-specific evidence and rationale.",
      "evidence_refs": []
    }
  ],
  "concerns": [
    {
      "concern_id": "OUTCOME_VALUE",
      "status": "OPTIONAL",
      "owner": "project-reviewer",
      "reason": "Illustrative example: replace with project-specific evidence and rationale.",
      "revisit_trigger": "risk or scope change",
      "evidence_refs": []
    },
    {
      "concern_id": "USERS_ACCESSIBILITY",
      "status": "OPTIONAL",
      "owner": "project-reviewer",
      "reason": "Illustrative example: replace with project-specific evidence and rationale.",
      "revisit_trigger": "risk or scope change",
      "evidence_refs": []
    },
    {
      "concern_id": "RISK_SECURITY",
      "status": "OPTIONAL",
      "owner": "project-reviewer",
      "reason": "Illustrative example: replace with project-specific evidence and rationale.",
      "revisit_trigger": "risk or scope change",
      "evidence_refs": []
    },
    {
      "concern_id": "ARCHITECTURE_DEPENDENCIES",
      "status": "OPTIONAL",
      "owner": "project-reviewer",
      "reason": "Illustrative example: replace with project-specific evidence and rationale.",
      "revisit_trigger": "risk or scope change",
      "evidence_refs": []
    },
    {
      "concern_id": "DATA_PRIVACY",
      "status": "OPTIONAL",
      "owner": "project-reviewer",
      "reason": "Illustrative example: replace with project-specific evidence and rationale.",
      "revisit_trigger": "risk or scope change",
      "evidence_refs": []
    },
    {
      "concern_id": "QUALITY_ASSURANCE",
      "status": "OPTIONAL",
      "owner": "project-reviewer",
      "reason": "Illustrative example: replace with project-specific evidence and rationale.",
      "revisit_trigger": "risk or scope change",
      "evidence_refs": []
    },
    {
      "concern_id": "RELEASE_SUPPLYCHAIN",
      "status": "OPTIONAL",
      "owner": "project-reviewer",
      "reason": "Illustrative example: replace with project-specific evidence and rationale.",
      "revisit_trigger": "risk or scope change",
      "evidence_refs": []
    },
    {
      "concern_id": "OPERATIONS_RELIABILITY",
      "status": "OPTIONAL",
      "owner": "project-reviewer",
      "reason": "Illustrative example: replace with project-specific evidence and rationale.",
      "revisit_trigger": "risk or scope change",
      "evidence_refs": []
    },
    {
      "concern_id": "ECONOMICS_SUSTAINABILITY",
      "status": "OPTIONAL",
      "owner": "project-reviewer",
      "reason": "Illustrative example: replace with project-specific evidence and rationale.",
      "revisit_trigger": "risk or scope change",
      "evidence_refs": []
    },
    {
      "concern_id": "GOVERNANCE_EVIDENCE",
      "status": "OPTIONAL",
      "owner": "project-reviewer",
      "reason": "Illustrative example: replace with project-specific evidence and rationale.",
      "revisit_trigger": "risk or scope change",
      "evidence_refs": []
    }
  ],
  "cell_overrides": []
}
